{
  "name": "nginxui-test",
  "display_name": "Nginx UI Test Partner",
  "kind": "github_organization",
  "github_owner": "nginxui",
  "homepage_url": "https://nginxui.com",
  "description": "A test partner for the partner flow on the staging catalog.",
  "public_key": "RWRxdNEYmptmVyRHN8b4oslHq32UJA/z/wd/USbO5ymsYmEnvDwHARN5"
}
